{
  "id": "C-2023-0831",
  "type": "individual-claim",
  "status": "under-review",
  "created": "2023-08-31",
  "updated": "2025-10-21",
  "location": "individual-claims/C-2023-0831",
  "assigned_to": "MJ Ahmad",
  "notes": "Claimant is a relative; incident involves deception, fear tactics, and asset misuse."
}

