{
  "id": "G-2023-0831",
  "type": "group-claim",
  "status": "under-review",
  "created": "2023-08-31",
  "updated": "2025-10-21",
  "location": "group-claims/G-2023-0831",
  "assigned_to": "MJ Ahmad",
  "notes": "Group-based harm initiated by individual escalation. Includes intimidation, defamation, and coordinated sabotage."
}

